{
  "evaluation_id": "eval-emp-resolve-001",
  "created_at": "2026-06-01T09:00:00Z",
  "employee": {
    "employee_id": "emp-cs-demo-001",
    "role": {
      "role_id": "customer-service-ecommerce",
      "industry": "ecommerce",
      "responsibility_tags": ["customer_facing", "tool_use", "policy_application", "complaint_handling", "order_management"],
      "level": "employee"
    },
    "industry": "ecommerce",
    "job_responsibilities": "处理电商店铺的售前咨询、退款退货申请、物流延迟投诉与升级工单，需要查询订单状态、核对退款政策并在权限内为客户发起退款或转人工。",
    "employee_provenance": {
      "source": "authoritative_file",
      "reliability": "high"
    },
    "scenarios": ["pre_sales", "refund_request", "complaint", "service_failure"]
  },
  "candidate_metrics": [
    { "metric_code": "tool_call_correctness", "version": "1.0.0", "parent_dimension": "tool_call_correctness", "source_path": "metrics/tool_call_correctness.metric.json" },
    { "metric_code": "interaction_empathy", "version": "1.0.0", "parent_dimension": "interaction_quality", "source_path": "metrics/interaction_empathy.metric.json" },
    { "metric_code": "order_refund_policy_accuracy", "version": "1.0.0", "parent_dimension": "functional_completeness", "source_path": "metrics/order_refund_policy_accuracy.metric.json" },
    { "metric_code": "problem_resolution_completeness", "version": "1.0.0", "parent_dimension": "problem_resolution", "source_path": "metrics/problem_resolution_completeness.metric.json" },
    { "metric_code": "response_clarity_and_structure", "version": "1.0.0", "parent_dimension": "interaction_quality", "source_path": "metrics/response_clarity_and_structure.metric.json" },
    { "metric_code": "response_conciseness", "version": "1.0.0", "parent_dimension": "interaction_quality", "source_path": "metrics/response_conciseness.metric.json" },
    { "metric_code": "factual_accuracy", "version": "1.0.0", "parent_dimension": "functional_completeness", "source_path": "metrics/factual_accuracy.metric.json" },
    { "metric_code": "proactive_clarification", "version": "1.0.0", "parent_dimension": "problem_resolution", "source_path": "metrics/proactive_clarification.metric.json" },
    { "metric_code": "safety_and_ethics_boundary", "version": "1.0.0", "parent_dimension": "process_compliance", "source_path": "metrics/safety_and_ethics_boundary.metric.json" },
    { "metric_code": "professional_tone_consistency", "version": "1.0.0", "parent_dimension": "interaction_quality", "source_path": "metrics/professional_tone_consistency.metric.json" }
  ],
  "dropped_metrics": [
    { "metric_code": "attendance_rule_compliance", "applicable_roles": ["hr-attendance"], "drop_reason": "role_mismatch" },
    { "metric_code": "bid_clause_completeness", "applicable_roles": ["bid-writer"], "drop_reason": "role_mismatch" },
    { "metric_code": "legal_citation_accuracy", "applicable_roles": ["legal-expert"], "drop_reason": "role_mismatch" },
    { "metric_code": "code_change_risk_disclosure", "applicable_roles": ["software-engineer"], "drop_reason": "role_mismatch" },
    { "metric_code": "confidentiality_boundary_compliance", "applicable_roles": ["legal-expert", "bid-writer", "hr-attendance", "software-engineer"], "drop_reason": "role_mismatch" }
  ],
  "selected_metrics": [
    { "metric_code": "tool_call_correctness", "version": "1.0.0", "parent_dimension": "tool_call_correctness", "source_path": "metrics/tool_call_correctness.metric.json" },
    { "metric_code": "interaction_empathy", "version": "1.0.0", "parent_dimension": "interaction_quality", "source_path": "metrics/interaction_empathy.metric.json" },
    { "metric_code": "order_refund_policy_accuracy", "version": "1.0.0", "parent_dimension": "functional_completeness", "source_path": "metrics/order_refund_policy_accuracy.metric.json" },
    { "metric_code": "problem_resolution_completeness", "version": "1.0.0", "parent_dimension": "problem_resolution", "source_path": "metrics/problem_resolution_completeness.metric.json" },
    { "metric_code": "response_clarity_and_structure", "version": "1.0.0", "parent_dimension": "interaction_quality", "source_path": "metrics/response_clarity_and_structure.metric.json" },
    { "metric_code": "response_conciseness", "version": "1.0.0", "parent_dimension": "interaction_quality", "source_path": "metrics/response_conciseness.metric.json" },
    { "metric_code": "factual_accuracy", "version": "1.0.0", "parent_dimension": "functional_completeness", "source_path": "metrics/factual_accuracy.metric.json" },
    { "metric_code": "proactive_clarification", "version": "1.0.0", "parent_dimension": "problem_resolution", "source_path": "metrics/proactive_clarification.metric.json" },
    { "metric_code": "safety_and_ethics_boundary", "version": "1.0.0", "parent_dimension": "process_compliance", "source_path": "metrics/safety_and_ethics_boundary.metric.json" },
    { "metric_code": "professional_tone_consistency", "version": "1.0.0", "parent_dimension": "interaction_quality", "source_path": "metrics/professional_tone_consistency.metric.json" }
  ],
  "curate_log": [],
  "metric_selection_policy": {
    "mode": "auto",
    "max_metrics": 8,
    "min_dimensions_covered": 1,
    "auto_apply_threshold": 0.7,
    "size_triggers": { "candidate_count_lower_bound": 3, "candidate_count_upper_bound": 15 }
  },
  "employee_resolution_log": [
    {
      "round": 0,
      "user_response": "confirm",
      "final_confirmed_draft": {
        "note": "authoritative_file source — no user dialog round actually occurred; recorded for trace completeness",
        "role_id_before_canonicalization": "电商客服",
        "role_id_after_canonicalization": "customer-service-ecommerce"
      }
    }
  ],
  "enriched_test_cases": [
    {
      "test_case_id": "tc-refund-7day-eligible",
      "source_path": "runs/eval-emp-resolve-001/enriched-cases/tc-refund-7day-eligible.json",
      "applicable_metrics": ["tool_call_correctness", "order_refund_policy_accuracy", "problem_resolution_completeness", "response_clarity_and_structure", "response_conciseness", "factual_accuracy", "proactive_clarification", "safety_and_ethics_boundary", "professional_tone_consistency", "interaction_empathy"],
      "is_synthesized": false
    }
  ],
  "fan_out_plan": {
    "total": 10,
    "pairs": [
      { "test_case_id": "tc-refund-7day-eligible", "metric_code": "tool_call_correctness" },
      { "test_case_id": "tc-refund-7day-eligible", "metric_code": "interaction_empathy" },
      { "test_case_id": "tc-refund-7day-eligible", "metric_code": "order_refund_policy_accuracy" },
      { "test_case_id": "tc-refund-7day-eligible", "metric_code": "problem_resolution_completeness" },
      { "test_case_id": "tc-refund-7day-eligible", "metric_code": "response_clarity_and_structure" },
      { "test_case_id": "tc-refund-7day-eligible", "metric_code": "response_conciseness" },
      { "test_case_id": "tc-refund-7day-eligible", "metric_code": "factual_accuracy" },
      { "test_case_id": "tc-refund-7day-eligible", "metric_code": "proactive_clarification" },
      { "test_case_id": "tc-refund-7day-eligible", "metric_code": "safety_and_ethics_boundary" },
      { "test_case_id": "tc-refund-7day-eligible", "metric_code": "professional_tone_consistency" }
    ]
  },
  "paths": {
    "metrics_dir": "./metrics/",
    "test_cases_dir": "./test-cases/",
    "run_dir": "./runs/eval-emp-resolve-001/",
    "drivers_dir": "./runtime-drivers/",
    "simulators_dir": "./simulators/"
  },
  "runtime_driver": {
    "driver_id": "ws_jwt",
    "driver_config": { "endpoint": "ws://localhost:8080", "token": "demo-jwt" }
  },
  "runtime_simulator": {
    "simulator_id": "customer_realistic"
  },
  "global_turn_cap": 30,
  "open_questions": [
    "FIXTURE: happy-path demonstrating STEP 0 authoritative_file resolution (role '电商客服' canonicalized to 'customer-service-ecommerce') + STEP 1.2 auto-skip (candidate count 10 is within [3,15], so the Metric_Curator does NOT run and selected_metrics == candidate_metrics).",
    "FIXTURE NOTE: selected_metrics has 10 entries while metric_selection_policy.max_metrics is 8. This is intentional and valid: the max_metrics bound is enforced ONLY post-curation (R12.8). When STEP 1.2 is skipped (auto + in-range), no curation occurs, so the bound is not applied and the deterministic candidate set passes through unchanged (Correctness Property 10)."
  ]
}
